{
  "$schema": "./avo.project.schema.json",
  "provider": "my-channel",
  "rawDir": "/absolute/path/to/footage/my-video",
  "title": "Working title",
  "assets": {
    "sfx": "/absolute/path/to/assets/sfx",
    "music": "/absolute/path/to/assets/music",
    "inserts": "",
    "graphics": "",
    "logos": "providers/my-channel/logo"
  },
  "transcription": {
    "language": "en"
  },
  "approvalGates": {
    "requireHumanSignOff": true,
    "checkpoints": ["edit-proof", "motion-proof", "pre-master"]
  }
}
